{
  "$schemaVersion": "v1",
  "generatedAt": "2026-09-13T04:33:15Z",
  "source": "assets/data/package-sources.json",
  "items": [
    {
      "id": "crates.io:ares-api",
      "ecosystem": "crates.io",
      "name": "ares-api",
      "displayName": "ares-api",
      "summary": "HTTP server for Ares AI scraper",
      "version": "0.4.0",
      "url": "https://crates.io/crates/ares-api",
      "repositoryUrl": "https://github.com/AndreaBozzo/Ares",
      "license": "Apache-2.0",
      "publishedAt": "2026-06-22T14:51:46Z",
      "updatedAt": "2026-06-22T14:51:46Z",
      "downloadsTotal": 82,
      "recentDownloads": 36,
      "relatedCaseStudies": [
        "ares-ceres"
      ]
    },
    {
      "id": "crates.io:ares-cli",
      "ecosystem": "crates.io",
      "name": "ares-cli",
      "displayName": "ares-cli",
      "summary": "CLI entry point for Ares AI scraper",
      "version": "0.4.0",
      "url": "https://crates.io/crates/ares-cli",
      "repositoryUrl": "https://github.com/AndreaBozzo/Ares",
      "license": "Apache-2.0",
      "publishedAt": "2026-06-22T14:49:07Z",
      "updatedAt": "2026-06-22T14:49:07Z",
      "downloadsTotal": 93,
      "recentDownloads": 39,
      "relatedCaseStudies": [
        "ares-ceres"
      ]
    },
    {
      "id": "crates.io:ares-client",
      "ecosystem": "crates.io",
      "name": "ares-client",
      "displayName": "ares-client",
      "summary": "HTTP fetcher, HTML cleaner, and LLM extraction client for Ares",
      "version": "0.4.0",
      "url": "https://crates.io/crates/ares-client",
      "repositoryUrl": "https://github.com/AndreaBozzo/Ares",
      "license": "Apache-2.0",
      "publishedAt": "2026-06-22T14:44:57Z",
      "updatedAt": "2026-06-22T14:44:57Z",
      "downloadsTotal": 308,
      "recentDownloads": 128,
      "relatedCaseStudies": [
        "ares-ceres"
      ]
    },
    {
      "id": "crates.io:ares-core",
      "ecosystem": "crates.io",
      "name": "ares-core",
      "displayName": "ares-core",
      "summary": "Core types, traits, and error handling for Ares AI scraper",
      "version": "0.4.0",
      "url": "https://crates.io/crates/ares-core",
      "repositoryUrl": "https://github.com/AndreaBozzo/Ares",
      "license": "Apache-2.0",
      "publishedAt": "2026-06-22T14:42:45Z",
      "updatedAt": "2026-06-22T14:42:45Z",
      "downloadsTotal": 495,
      "recentDownloads": 199,
      "relatedCaseStudies": [
        "ares-ceres"
      ]
    },
    {
      "id": "crates.io:ares-db",
      "ecosystem": "crates.io",
      "name": "ares-db",
      "displayName": "ares-db",
      "summary": "PostgreSQL repository layer for Ares AI scraper",
      "version": "0.4.0",
      "url": "https://crates.io/crates/ares-db",
      "repositoryUrl": "https://github.com/AndreaBozzo/Ares",
      "license": "Apache-2.0",
      "publishedAt": "2026-06-22T14:46:41Z",
      "updatedAt": "2026-06-22T14:46:41Z",
      "downloadsTotal": 304,
      "recentDownloads": 125,
      "relatedCaseStudies": [
        "ares-ceres"
      ]
    },
    {
      "id": "crates.io:ceres-client",
      "ecosystem": "crates.io",
      "name": "ceres-client",
      "displayName": "ceres-client",
      "summary": "HTTP clients for Ceres portal harvesters and embedding providers",
      "version": "0.7.0",
      "url": "https://crates.io/crates/ceres-client",
      "repositoryUrl": "https://github.com/AndreaBozzo/Ceres",
      "license": "Apache-2.0",
      "publishedAt": "2026-08-19T12:15:56Z",
      "updatedAt": "2026-08-19T12:15:56Z",
      "downloadsTotal": 549,
      "recentDownloads": 236,
      "relatedCaseStudies": [
        "ares-ceres"
      ]
    },
    {
      "id": "crates.io:ceres-core",
      "ecosystem": "crates.io",
      "name": "ceres-core",
      "displayName": "ceres-core",
      "summary": "Core types, harvesting logic, and services for Ceres",
      "version": "0.7.0",
      "url": "https://crates.io/crates/ceres-core",
      "repositoryUrl": "https://github.com/AndreaBozzo/Ceres",
      "license": "Apache-2.0",
      "publishedAt": "2026-08-19T12:13:48Z",
      "updatedAt": "2026-08-19T12:13:48Z",
      "downloadsTotal": 830,
      "recentDownloads": 320,
      "relatedCaseStudies": [
        "ares-ceres"
      ]
    },
    {
      "id": "crates.io:ceres-db",
      "ecosystem": "crates.io",
      "name": "ceres-db",
      "displayName": "ceres-db",
      "summary": "Database repository layer for Ceres with pgvector support",
      "version": "0.7.0",
      "url": "https://crates.io/crates/ceres-db",
      "repositoryUrl": "https://github.com/AndreaBozzo/Ceres",
      "license": "Apache-2.0",
      "publishedAt": "2026-08-19T12:17:45Z",
      "updatedAt": "2026-08-19T12:17:45Z",
      "downloadsTotal": 543,
      "recentDownloads": 231,
      "relatedCaseStudies": [
        "ares-ceres"
      ]
    },
    {
      "id": "crates.io:ceres-search",
      "ecosystem": "crates.io",
      "name": "ceres-search",
      "displayName": "ceres-search",
      "summary": "Command-line interface for harvesting, embedding, and searching with Ceres",
      "version": "0.7.0",
      "url": "https://crates.io/crates/ceres-search",
      "repositoryUrl": "https://github.com/AndreaBozzo/Ceres",
      "license": "Apache-2.0",
      "publishedAt": "2026-08-19T12:19:27Z",
      "updatedAt": "2026-08-19T12:19:27Z",
      "downloadsTotal": 240,
      "recentDownloads": 133,
      "relatedCaseStudies": [
        "ares-ceres"
      ]
    },
    {
      "id": "crates.io:dataprof",
      "ecosystem": "crates.io",
      "name": "dataprof",
      "displayName": "dataprof",
      "summary": "High-performance data profiler with ISO 8000/25012 quality metrics for CSV, JSON/JSONL, and Parquet files",
      "version": "0.11.0",
      "url": "https://crates.io/crates/dataprof",
      "repositoryUrl": "https://github.com/AndreaBozzo/dataprof",
      "documentationUrl": "https://docs.rs/dataprof",
      "homepageUrl": "https://andreabozzo.github.io/dataprof/",
      "license": "MIT OR Apache-2.0",
      "publishedAt": "2026-08-25T14:38:11Z",
      "updatedAt": "2026-08-25T14:38:11Z",
      "downloadsTotal": 4746,
      "recentDownloads": 256,
      "relatedCaseStudies": [
        "dataprof"
      ]
    },
    {
      "id": "pypi:dataprof",
      "ecosystem": "pypi",
      "name": "dataprof",
      "displayName": "dataprof",
      "summary": "Fast, lightweight data profiling and quality assessment library",
      "version": "0.11.0",
      "url": "https://pypi.org/project/dataprof/",
      "repositoryUrl": "https://github.com/AndreaBozzo/dataprof",
      "homepageUrl": "https://andreabozzo.github.io/dataprof/",
      "runtimeRequirement": "\u003e=3.10",
      "publishedAt": "2026-08-25T14:40:09Z",
      "relatedCaseStudies": [
        "dataprof"
      ]
    }
  ]
}
